{
  "panelTitle": "What you'll need",
  "show": "Show checklist",
  "hide": "Hide checklist",
  "phoneButton": "What you'll need",
  "intro": "Work through it in order. Not everything applies to every family.",
  "obituaryNote": "Write and publish it after the service date is set, before the service itself.",
  "done": "Done",
  "notApplicable": "Doesn't apply",
  "nowPhase": "Now: {phase}",
  "nextItem": "Next on the list: {item}",
  "onTheChecklist": "On the checklist: {item}",
  "openSection": "Open {section}",
  "back": "Back",
  "whatItIs": "What it is",
  "whyItMatters": "Why it matters",
  "whoToCall": "Who to call",
  "whatToBring": "What to bring",
  "notApplicableWhen": "Doesn't apply when",
  "comingSoon": "More guidance is coming.",
  "phases": {
    "right-away": "Right away (first 24 to 48 hours)",
    "first-days": "Within the first few days",
    "obituary": "Obituary",
    "planning-service": "Planning the service",
    "first-weeks": "Within the first few weeks",
    "first-months": "Within the first few months"
  },
  "items": {
    "pronouncement": "Get a legal pronouncement of death",
    "custody": "Contact a funeral home or cremation provider to take custody of the body",
    "find-wishes": "Find any pre-arranged plans, will, or written final wishes",
    "tell-close-family": "Tell immediate family and closest friends yourself, by phone or a personal message, before anything public",
    "dependents-care": "Arrange care for dependents and pets",
    "secure-home": "Secure the home, mail, and valuables",
    "burial-or-cremation": "Choose burial or cremation with the funeral home",
    "casket-or-urn": "Choose a casket or urn, and a plot or niche if needed",
    "set-service": "Set a date, time, and place for the service, or confirm there will not be one",
    "officiant": "Decide who will officiate",
    "death-certificates": "Request several certified copies of the death certificate",
    "pallbearers": "Choose pallbearers, if you want them",
    "viewing-clothing-photo": "Choose clothing and a photo for a viewing, if there is one",
    "confirm-service-details": "Confirm the service date, time, and place with the funeral home",
    "write-obituary": "Write the obituary and include the service details",
    "submit-obituary": "Submit the obituary to the newspaper or the funeral home website",
    "share-obituary": "Share the obituary more widely, by email or social media, once it is published",
    "flowers-programs-music": "Arrange flowers, programs, and music",
    "guest-book": "Prepare a guest book",
    "reception": "Plan a reception or gathering after the service",
    "eulogy": "Ask someone to give a eulogy, or prepare one yourself",
    "family-transport": "Arrange transportation for family, if needed",
    "notify-community": "Tell their employer, clergy, and community groups",
    "notify-ssa": "Notify Social Security",
    "notify-banks": "Notify banks, credit card companies, and other financial institutions",
    "life-insurance-claims": "Notify the life insurance company and file claims",
    "pension-retirement": "Notify pension and retirement plan administrators",
    "utilities-housing": "Notify utility companies, the landlord, or the mortgage holder",
    "cancel-subscriptions": "Cancel subscriptions, memberships, and recurring services",
    "forward-mail": "Forward mail",
    "thank-you-notes": "Send thank-you notes for flowers, gifts, and support",
    "will-and-probate": "Talk to an attorney about the will and probate, if it applies",
    "retitle-property": "Retitle or transfer shared property, vehicles, and accounts",
    "online-accounts": "Close or transfer email and social media accounts",
    "final-tax-return": "File their final income tax return",
    "headstone": "Order a headstone or grave marker, if you want one",
    "follow-up-claims": "Follow up on any pending insurance or benefits claims"
  }
}
